{
  "$schema": "https://json-schema.org/draft/2020-12/schema",
  "$id": "https://gamemappermind.app/schemas/game_profile.schema.json",
  "title": "GameMapper Game Profile",
  "description": "Canonical contract for a gamepad-to-touch mapping profile. Both the TypeScript (Zod) and Kotlin (kotlinx.serialization) validators MUST conform to this schema. Any divergence is a bug.",
  "type": "object",
  "additionalProperties": false,
  "required": [
    "schemaVersion",
    "profileId",
    "gameName",
    "packageName",
    "screenSize",
    "orientation",
    "mappings",
    "metadata"
  ],
  "properties": {
    "schemaVersion": {
      "type": "string",
      "description": "SemVer string. Current contract: 1.0.0. Bumped on every breaking change.",
      "pattern": "^[0-9]+\\.[0-9]+\\.[0-9]+(-[a-zA-Z0-9.]+)?$",
      "examples": ["1.0.0"]
    },
    "profileId": {
      "type": "string",
      "description": "Stable identifier. Lowercase kebab-case. Used as filename stem.",
      "pattern": "^[a-z0-9]+(-[a-z0-9]+)*$",
      "maxLength": 64,
      "examples": ["pubgm-classic", "freefire-default"]
    },
    "gameName": {
      "type": "string",
      "minLength": 1,
      "maxLength": 128,
      "description": "Human-readable game title (e.g., 'PUBG Mobile')."
    },
    "packageName": {
      "type": "string",
      "description": "Android package name of the target game. Used for auto-switching profiles.",
      "pattern": "^[a-z][a-z0-9_]*(\\.[a-z][a-z0-9_]*)+$",
      "examples": ["com.tencent.ig", "com.dts.freefireth"]
    },
    "screenSize": {
      "type": "object",
      "additionalProperties": false,
      "required": ["width", "height"],
      "properties": {
        "width":  { "type": "integer", "minimum": 1, "maximum": 7680 },
        "height": { "type": "integer", "minimum": 1, "maximum": 4320 }
      }
    },
    "orientation": {
      "type": "string",
      "enum": ["landscape", "portrait", "auto"]
    },
    "deadzone": {
      "type": "object",
      "additionalProperties": false,
      "required": ["leftStick", "rightStick"],
      "properties": {
        "leftStick":  { "type": "number", "minimum": 0.0, "maximum": 0.5, "default": 0.10 },
        "rightStick": { "type": "number", "minimum": 0.0, "maximum": 0.5, "default": 0.10 }
      }
    },
    "sensitivity": {
      "type": "object",
      "additionalProperties": false,
      "required": ["leftStick", "rightStick"],
      "properties": {
        "leftStick":  { "type": "number", "minimum": 0.1, "maximum": 5.0, "default": 1.0 },
        "rightStick": { "type": "number", "minimum": 0.1, "maximum": 5.0, "default": 1.0 }
      }
    },
    "mappings": {
      "type": "array",
      "description": "Ordered list of button → touch mappings. Order matters for LRU pointer allocation.",
      "minItems": 0,
      "maxItems": 50,
      "items": { "$ref": "#/$defs/Mapping" }
    },
    "swipeTriggers": {
      "type": "array",
      "description": "Custom swipe triggers — any gamepad button can fire a directional swipe.",
      "minItems": 0,
      "maxItems": 20,
      "items": { "$ref": "#/$defs/SwipeTrigger" },
      "default": []
    },
    "metadata": {
      "type": "object",
      "additionalProperties": false,
      "required": ["author", "version", "createdAt", "updatedAt"],
      "properties": {
        "author":    { "type": "string", "minLength": 1, "maxLength": 64 },
        "version":   { "type": "string", "pattern": "^[0-9]+\\.[0-9]+\\.[0-9]+$" },
        "createdAt": { "type": "string", "format": "date-time" },
        "updatedAt": { "type": "string", "format": "date-time" },
        "notes":     { "type": "string", "maxLength": 512, "default": "" },
        "tags": {
          "type": "array",
          "items": { "type": "string", "maxLength": 32 },
          "maxItems": 10,
          "default": []
        }
      }
    }
  },
  "$defs": {
    "Mapping": {
      "type": "object",
      "additionalProperties": false,
      "required": ["id", "buttonCode", "action", "xPercent", "yPercent"],
      "properties": {
        "id": {
          "type": "integer",
          "minimum": 0,
          "maximum": 89,
          "description": "Pointer pool slot offset (actual slot = id + 10)."
        },
        "buttonCode": {
          "type": "integer",
          "description": "Linux evdev button code (BTN_SOUTH=304, BTN_EAST=305, etc.). See linux/input-event-codes.h.",
          "minimum": 0,
          "maximum": 1023,
          "examples": [304, 305, 308, 310, 311, 312, 313, 314, 315, 316, 317]
        },
        "buttonName": {
          "type": "string",
          "maxLength": 32,
          "description": "Human-readable button name for UI display. Optional but recommended."
        },
        "action": {
          "type": "string",
          "enum": ["tap", "swipe", "hold"]
        },
        "xPercent": {
          "type": "number",
          "minimum": 0.0,
          "maximum": 1.0,
          "description": "X coordinate as fraction of screen width [0..1]."
        },
        "yPercent": {
          "type": "number",
          "minimum": 0.0,
          "maximum": 1.0,
          "description": "Y coordinate as fraction of screen height [0..1]."
        },
        "endXPercent": {
          "type": "number",
          "minimum": 0.0,
          "maximum": 1.0,
          "default": 0.0,
          "description": "Required for action=swipe. Ignored otherwise."
        },
        "endYPercent": {
          "type": "number",
          "minimum": 0.0,
          "maximum": 1.0,
          "default": 0.0,
          "description": "Required for action=swipe. Ignored otherwise."
        },
        "durationMs": {
          "type": "integer",
          "minimum": 16,
          "maximum": 5000,
          "default": 80,
          "description": "Duration of swipe or hold gesture in milliseconds."
        },
        "pressure": {
          "type": "number",
          "minimum": 0.0,
          "maximum": 1.0,
          "default": 1.0
        },
        "antiBan": {
          "type": "object",
          "additionalProperties": false,
          "properties": {
            "jitterPx":      { "type": "number", "minimum": 0.0, "maximum": 8.0, "default": 1.0 },
            "timingJitterMs":{ "type": "number", "minimum": 0.0, "maximum": 32.0, "default": 4.0 },
            "pressureVar":   { "type": "number", "minimum": 0.0, "maximum": 0.3, "default": 0.05 }
          },
          "default": {}
        }
      },
      "allOf": [
        {
          "if": { "properties": { "action": { "const": "swipe" } } },
          "then": { "required": ["endXPercent", "endYPercent"] }
        }
      ]
    },
    "SwipeTrigger": {
      "type": "object",
      "additionalProperties": false,
      "required": ["buttonCode", "direction"],
      "properties": {
        "buttonCode": { "type": "integer", "minimum": 0, "maximum": 1023 },
        "direction": {
          "type": "string",
          "enum": ["up", "down", "left", "right"]
        },
        "durationMs": { "type": "integer", "minimum": 16, "maximum": 2000, "default": 120 },
        "span": {
          "type": "number",
          "minimum": 0.1,
          "maximum": 1.0,
          "default": 0.33,
          "description": "Swipe span as fraction of min(screenW, screenH)."
        }
      }
    }
  }
}
